<?xml version="1.0" encoding="UTF-8"?>
<!ELEMENT Languages (Keys*)>
<!ELEMENT Keys (KeyWord,KeyValue)>
<!ELEMENT KeyWord (#PCDATA)>
<!ELEMENT KeyValue (#PCDATA)>